date,title,url,source,tone,tone_label
2007-05-15,Google data center opens in The Dalles,,The Oregonian,2.5,positive
2014-03-10,The Dalles negotiates data center water deal with Google,,Columbian,0.0,neutral
2016-08-20,Columbia River water rights controversy: data center use,,The Oregonian,-3.5,negative
2019-04-12,Apple data center expansion approved,,Columbia Gorge News,0.0,neutral
2020-07-05,Oregon drought raises data center water questions,,The Oregonian,-3.5,negative
2021-09-14,The Dalles City Council reviews data center agreements,,Columbia Gorge News,0.0,neutral
2022-06-08,Environmental groups challenge data center water permits,,Willamette Week,-3.5,negative
2023-03-20,Oregon legislature considers data center disclosure bill,,OPB,-3.5,negative
2024-01-10,Columbia River water compact revised,,Oregon Water Resources,0.0,neutral
