page,date_raw,date_parsed,headline,url,tags,contestation
5,2026-04-20,2026-04-20,CoreWeave and Google raise $6.7bn in junk bond offering - report,https://www.datacenterdynamics.com/en/news/coreweave-and-google-raise-67bn-in-junk-bond-offering-report/,,False
5,2026-04-20,2026-04-20,"Developer withdraws application for 70MW data center in Hutto, Texas",https://www.datacenterdynamics.com/en/news/developer-withdraws-application-for-70mw-data-center-in-hutto-texas/,,True
5,2026-04-20,2026-04-20,"FERC approves transmission agreement for planned 1GW Tract data center in Morris, Illinois",https://www.datacenterdynamics.com/en/news/ferc-approves-transmission-agreement-for-planned-1gw-tract-data-center-in-morris-illinois/,,False
5,2026-04-20,2026-04-20,Officials in North Carolina county void data center rezoning amid legal challenge,https://www.datacenterdynamics.com/en/news/officials-in-north-carolina-county-void-data-center-rezoning-amid-legal-challenge/,,True
5,2026-04-20,2026-04-20,"Aussie data center firm NextDC secures 250MW data center deals, set to raise more than  AU$1.5 billion via new shares",https://www.datacenterdynamics.com/en/news/aussie-data-center-firm-nextdc-secures-250mw-data-center-deals-set-to-raise-more-than-au15-billion-via-new-shares/,,False
5,2026-04-20,2026-04-20,OptiCool and Belden team up on rack-level liquid cooling solution,https://www.datacenterdynamics.com/en/news/opticool-and-belden-team-up-on-rack-level-liquid-cooling-solution/,,False
5,2026-04-20,2026-04-20,"Google takes over Project Maize data center campus in Michigan City, Indiana",https://www.datacenterdynamics.com/en/news/google-takes-over-project-maize-data-center-campus-in-michigan-city-indiana/,,True
5,2026-04-20,2026-04-20,"Microsoft CEO says Fairwater data center site is ""going live ahead of schedule""",https://www.datacenterdynamics.com/en/news/microsoft-ceo-says-fairwater-data-center-site-is-going-live-ahead-of-schedule/,,False
5,2026-04-20,2026-04-20,"DayOne inks 450MW PPA with PLN Batam to power planned data center in Batam, Indonesia",https://www.datacenterdynamics.com/en/news/dayone-inks-450mw-ppa-with-pln-batam-to-power-planned-data-center-in-batam-indonesia/,,False
5,2026-04-20,2026-04-20,"APAC data center firm AirTrunk enters India, acquires Lumina CloudInfra",https://www.datacenterdynamics.com/en/news/apac-data-center-firm-airtrunk-enters-india-acquires-lumina-cloudinfra/,,False
5,2026-04-20,2026-04-20,"$1.7bn data center could be built in Lebanon County, Pennsylvania",https://www.datacenterdynamics.com/en/news/17bn-data-center-could-be-built-in-lebanon-county-pennsylvania/,,True
5,2026-04-20,2026-04-20,Nokia spins off space communications venture Modul8,https://www.datacenterdynamics.com/en/news/nokia-spins-off-space-communications-venture-modul8/,,False
5,2026-04-20,2026-04-20,Archangel Lightworks secures $13.57m in Series A funding to scale optical downstream technology,https://www.datacenterdynamics.com/en/news/archangel-lightworks-secures-1357m-in-series-a-funding-to-scale-optical-downstream-technology/,,False
5,2026-04-19,2026-04-19,"Think-tank sues Tennessee county over data center and crypto ban, calls block unconstitutional",https://www.datacenterdynamics.com/en/news/think-tank-sues-tennessee-county-over-data-center-and-crypto-ban-calls-block-unconstitutional/,,True
5,2026-04-19,2026-04-19,EU Commission selects four cloud providers under €180m sovereign cloud tender,https://www.datacenterdynamics.com/en/news/eu-commission-selects-four-cloud-providers-under-180m-sovereign-cloud-tender/,,False
